name,tel,address,商店編號,lng,lat,X,Y
全家瑞芳龍川店,224061884,新北市瑞芳區一坑路１１之１號,14696,121.8041868,25.1084672,378597.574,2777735.335
全家瑞芳傑魚坑店,224969517,新北市瑞芳區傑魚坑路６２號,18972,121.7934282,25.1107669,377514.996,2777999.672
全家瑞芳前站店,224971401,新北市瑞芳區明燈路三段８４號１．２樓,60633,121.8055631,25.1083493,378736.238,2777721.049
全家瑞芳明燈店,224969741,新北市瑞芳區民生街２０號１樓及２樓部份,61895,121.805757,25.1074266,378754.886,2777618.69
全家九份觀景店,224969045,新北市瑞芳區輕便路４３號４樓,53604,121.8453322,25.1102218,382748.146,2777893.529
全家金瓜石黃金店,224962382,新北市瑞芳區金光路３６號１樓（部份）,59156,121.8572735,25.1086127,383950.718,2777705.083
